[
  {
    "id": "A-5.08.020-1",
    "provision_refs": [
      "5.08.020"
    ],
    "source_quote": "The license collector may make any administrative rules and regulations not inconsistent with the provisions of Chapters 5.04 through 5.24 as may be necessary and desirable to aid in the enforcement of the provisions of Chapters 5.04 through 5.24.",
    "signal": {
      "type": "discretionary",
      "text": "The license collector may make …",
      "confidence": "explicit"
    },
    "actor": {
      "id": "ACT-license-collector",
      "text": "the license collector",
      "confidence": "explicit"
    },
    "modality": "power",
    "action": {
      "verb": "make",
      "object": "administrative rules and regulations not inconsistent with Chapters 5.04 through 5.24, as necessary and desirable to aid enforcement",
      "confidence": "explicit"
    },
    "counterparty": {
      "id": "ACT-public",
      "text": null,
      "confidence": "inferred"
    },
    "timing": null,
    "conditions": [],
    "exceptions": [],
    "consequence": null,
    "attachments": [
      {
        "kind": "definition",
        "provision": "5.04.120",
        "summary": "definition of license collector"
      }
    ],
    "outputs": [
      "artifact:administrative-rules"
    ],
    "status": "complete",
    "orphan_flags": [],
    "link": null,
    "conflict_with": [],
    "resolution_note": null
  },
  {
    "id": "A-5.08.030-1",
    "provision_refs": [
      "5.08.030"
    ],
    "source_quote": "It shall be the duty of the license collector, his/her deputies, agents or employees, to administer Chapters 5.04 through 5.24 in accordance with the terms thereof.",
    "signal": {
      "type": "standing",
      "text": "It shall be the duty of the license collector …",
      "confidence": "explicit"
    },
    "actor": {
      "id": "ACT-license-collector",
      "text": "the license collector, his/her deputies, agents or employees",
      "confidence": "explicit"
    },
    "modality": "duty",
    "action": {
      "verb": "administer",
      "object": "Chapters 5.04 through 5.24 in accordance with their terms",
      "confidence": "explicit"
    },
    "counterparty": {
      "id": "ACT-public",
      "text": null,
      "confidence": "inferred"
    },
    "timing": null,
    "conditions": [],
    "exceptions": [],
    "consequence": null,
    "attachments": [
      {
        "kind": "definition",
        "provision": "5.04.120",
        "summary": "definition of license collector"
      }
    ],
    "outputs": [],
    "status": "complete",
    "orphan_flags": [],
    "link": null,
    "conflict_with": [],
    "resolution_note": null
  },
  {
    "id": "A-5.08.030-2",
    "provision_refs": [
      "5.08.030"
    ],
    "source_quote": "It shall be the duty of the license collector and he/she shall have the power regularly and promptly to require the licensing of all business",
    "signal": {
      "type": "standing",
      "text": "regularly and promptly",
      "confidence": "explicit"
    },
    "actor": {
      "id": "ACT-license-collector",
      "text": "the license collector",
      "confidence": "explicit"
    },
    "modality": "duty",
    "action": {
      "verb": "require",
      "object": "the licensing of all business",
      "confidence": "explicit"
    },
    "counterparty": {
      "id": "ACT-any-person",
      "text": null,
      "confidence": "inferred"
    },
    "timing": {
      "kind": "recurrence",
      "amount": null,
      "unit": null,
      "from": null,
      "direction": null,
      "business_days": false,
      "text": "regularly and promptly"
    },
    "conditions": [],
    "exceptions": [],
    "consequence": null,
    "attachments": [
      {
        "kind": "definition",
        "provision": "5.04.120",
        "summary": "definition of license collector"
      },
      {
        "kind": "definition",
        "provision": "5.04.130",
        "summary": "definition of any person"
      }
    ],
    "outputs": [],
    "status": "complete",
    "orphan_flags": [],
    "link": null,
    "conflict_with": [],
    "resolution_note": null
  },
  {
    "id": "A-5.08.030-3",
    "provision_refs": [
      "5.08.030"
    ],
    "source_quote": "to cause the collection of the fees therefor",
    "signal": {
      "type": "state",
      "text": "fees for licenses are due",
      "confidence": "inferred"
    },
    "actor": {
      "id": "ACT-license-collector",
      "text": "the license collector",
      "confidence": "explicit"
    },
    "modality": "duty",
    "action": {
      "verb": "cause the collection of",
      "object": "the license fees",
      "confidence": "explicit"
    },
    "counterparty": {
      "id": "ACT-any-person",
      "text": null,
      "confidence": "inferred"
    },
    "timing": null,
    "conditions": [],
    "exceptions": [],
    "consequence": null,
    "attachments": [
      {
        "kind": "definition",
        "provision": "5.04.120",
        "summary": "definition of license collector"
      },
      {
        "kind": "definition",
        "provision": "5.04.130",
        "summary": "definition of any person"
      }
    ],
    "outputs": [],
    "status": "complete",
    "orphan_flags": [],
    "link": null,
    "conflict_with": [],
    "resolution_note": null
  },
  {
    "id": "A-5.08.030-4",
    "provision_refs": [
      "5.08.030"
    ],
    "source_quote": "the prosecution of all persons violating any of the provisions of Chapters 5.04 through 5.24",
    "signal": {
      "type": "event",
      "text": "persons violating any provision of Chapters 5.04 through 5.24",
      "confidence": "explicit"
    },
    "actor": {
      "id": "ACT-license-collector",
      "text": "the license collector",
      "confidence": "explicit"
    },
    "modality": "duty",
    "action": {
      "verb": "cause the prosecution of",
      "object": "all persons violating Chapters 5.04 through 5.24",
      "confidence": "explicit"
    },
    "counterparty": {
      "id": "ACT-city",
      "text": null,
      "confidence": "inferred"
    },
    "timing": null,
    "conditions": [],
    "exceptions": [],
    "consequence": null,
    "attachments": [
      {
        "kind": "definition",
        "provision": "5.04.120",
        "summary": "definition of license collector"
      },
      {
        "kind": "definition",
        "provision": "5.04.040",
        "summary": "definition of city"
      }
    ],
    "outputs": [],
    "status": "complete",
    "orphan_flags": [],
    "link": null,
    "conflict_with": [],
    "resolution_note": null
  },
  {
    "id": "A-5.08.040.A-1",
    "provision_refs": [
      "5.08.040.A",
      "5.08.040"
    ],
    "source_quote": "To make arrests for the violation of any of the provisions of Chapters 5.04 through 5.24",
    "signal": {
      "type": "event",
      "text": "violation of any provision of Chapters 5.04 through 5.24",
      "confidence": "explicit"
    },
    "actor": {
      "id": "ACT-chief-of-police",
      "text": "The chief of police",
      "confidence": "explicit"
    },
    "modality": "duty",
    "action": {
      "verb": "make arrests for",
      "object": "violation of any provision of Chapters 5.04 through 5.24",
      "confidence": "explicit"
    },
    "counterparty": {
      "id": "ACT-any-person",
      "text": null,
      "confidence": "inferred"
    },
    "timing": null,
    "conditions": [],
    "exceptions": [],
    "consequence": null,
    "attachments": [
      {
        "kind": "definition",
        "provision": "5.04.130",
        "summary": "definition of any person"
      }
    ],
    "outputs": [],
    "status": "complete",
    "orphan_flags": [],
    "link": {
      "link_id": "L-5.08.040.A",
      "relation": "joint"
    },
    "conflict_with": [],
    "resolution_note": null
  },
  {
    "id": "A-5.08.040.A-2",
    "provision_refs": [
      "5.08.040.A",
      "5.08.040"
    ],
    "source_quote": "To make arrests for the violation of any of the provisions of Chapters 5.04 through 5.24",
    "signal": {
      "type": "event",
      "text": "violation of any provision of Chapters 5.04 through 5.24",
      "confidence": "explicit"
    },
    "actor": {
      "id": "ACT-police-officers",
      "text": "all police officers",
      "confidence": "explicit"
    },
    "modality": "duty",
    "action": {
      "verb": "make arrests for",
      "object": "violation of any provision of Chapters 5.04 through 5.24",
      "confidence": "explicit"
    },
    "counterparty": {
      "id": "ACT-any-person",
      "text": null,
      "confidence": "inferred"
    },
    "timing": null,
    "conditions": [],
    "exceptions": [],
    "consequence": null,
    "attachments": [
      {
        "kind": "definition",
        "provision": "5.04.130",
        "summary": "definition of any person"
      }
    ],
    "outputs": [],
    "status": "complete",
    "orphan_flags": [],
    "link": {
      "link_id": "L-5.08.040.A",
      "relation": "joint"
    },
    "conflict_with": [],
    "resolution_note": null
  },
  {
    "id": "A-5.08.040.B-1",
    "provision_refs": [
      "5.08.040.B",
      "5.08.040"
    ],
    "source_quote": "To enter free of charge at any reasonable time any place of business for which a license is required, and to demand the exhibition of such license for the current term from any person engaged or employed in the transaction of such business",
    "signal": {
      "type": "discretionary",
      "text": "at any reasonable time",
      "confidence": "explicit"
    },
    "actor": {
      "id": "ACT-chief-of-police",
      "text": "The chief of police",
      "confidence": "explicit"
    },
    "modality": "power",
    "action": {
      "verb": "enter and demand exhibition of license",
      "object": "any place of business for which a license is required, at any reasonable time, free of charge",
      "confidence": "explicit"
    },
    "counterparty": {
      "id": "ACT-any-person",